question_id,creation_date,title,score,answer_count,is_answered,link
79897384,2026-02-26 21:19:41,How to return binary from AWS Lambda with Function URL,0,0,False,https://stackoverflow.com/questions/79897384/how-to-return-binary-from-aws-lambda-with-function-url
79897380,2026-02-26 21:11:15,Bar chart legends in R,0,0,False,https://stackoverflow.com/questions/79897380/bar-chart-legends-in-r
79897374,2026-02-26 20:52:28,Quick AI translation,0,0,False,https://stackoverflow.com/questions/79897374/quick-ai-translation
79897369,2026-02-26 20:33:28,Getting the wireless network list with Android Studio,-1,0,False,https://stackoverflow.com/questions/79897369/getting-the-wireless-network-list-with-android-studio
79897361,2026-02-26 20:18:17,Assignment operator causes instantiation of constructor template,1,0,False,https://stackoverflow.com/questions/79897361/assignment-operator-causes-instantiation-of-constructor-template
79897359,2026-02-26 20:16:11,fetching from an API in react,0,2,False,https://stackoverflow.com/questions/79897359/fetching-from-an-api-in-react
79897354,2026-02-26 20:02:49,How to call a function in a .pyd library on exiting Python?,0,0,False,https://stackoverflow.com/questions/79897354/how-to-call-a-function-in-a-pyd-library-on-exiting-python
79897345,2026-02-26 19:36:42,App windows of apps launched from emacs not getting their own icon in ubuntu dock,-2,0,False,https://stackoverflow.com/questions/79897345/app-windows-of-apps-launched-from-emacs-not-getting-their-own-icon-in-ubuntu-doc
79897344,2026-02-26 19:36:02,FirebaseAnalytic revenue,-1,1,True,https://stackoverflow.com/questions/79897344/firebaseanalytic-revenue
79897343,2026-02-26 19:33:08,"I&#39;m starting to learn java. What is the actual way of saving information of my classes, when i only run the program in the Eclipse IDE?",0,4,True,https://stackoverflow.com/questions/79897343/im-starting-to-learn-java-what-is-the-actual-way-of-saving-information-of-my-c
79897341,2026-02-26 19:26:09,How do I query in Fluent (in Vapor) for items with a nil value for an OptionalParent relation?,0,1,True,https://stackoverflow.com/questions/79897341/how-do-i-query-in-fluent-in-vapor-for-items-with-a-nil-value-for-an-optionalpa
79897340,2026-02-26 19:26:00,Analyzing isotopic niche overlap using R package SIBER,0,0,False,https://stackoverflow.com/questions/79897340/analyzing-isotopic-niche-overlap-using-r-package-siber
79897328,2026-02-26 18:57:33,ReactReader CFI not restoring correct page – always opens chapter title page (persist + search issue),-3,0,False,https://stackoverflow.com/questions/79897328/reactreader-cfi-not-restoring-correct-page-always-opens-chapter-title-page-pe
79897325,2026-02-26 18:45:56,Docker GitLab image - private project accessible by all?,-4,0,False,https://stackoverflow.com/questions/79897325/docker-gitlab-image-private-project-accessible-by-all
79897322,2026-02-26 18:36:39,Linux Kernal 2.6.3x build errors,-5,0,False,https://stackoverflow.com/questions/79897322/linux-kernal-2-6-3x-build-errors
79897320,2026-02-26 18:35:13,Modify both inner and outer part of a nested structure in a loop,1,1,True,https://stackoverflow.com/questions/79897320/modify-both-inner-and-outer-part-of-a-nested-structure-in-a-loop
79897314,2026-02-26 18:26:07,How to read in local file in react,-1,1,True,https://stackoverflow.com/questions/79897314/how-to-read-in-local-file-in-react
79897306,2026-02-26 18:13:23,What are best practices for using AI tools in production without over-relying on them?,1,0,False,https://stackoverflow.com/questions/79897306/what-are-best-practices-for-using-ai-tools-in-production-without-over-relying-on
79897301,2026-02-26 18:06:51,How can I add multiple values in a single model in SleekCMS?,1,1,True,https://stackoverflow.com/questions/79897301/how-can-i-add-multiple-values-in-a-single-model-in-sleekcms
79897294,2026-02-26 17:47:53,Has anyone made Linux Multi-touch HID USB Gadget work with a Windows host?,0,0,False,https://stackoverflow.com/questions/79897294/has-anyone-made-linux-multi-touch-hid-usb-gadget-work-with-a-windows-host
